{
  "ticket_id": "21",
  "pinned_comment_id": 5079719574,
  "status": "ACTIVE",
  "runs": [
    {
      "run_id": "c6dc29402bf18454",
      "task_id": "spec",
      "task_version": 1,
      "ticket_id": "21",
      "state": "RUNNING",
      "attempt": 0,
      "bindings": {},
      "cost_usd": null,
      "tokens": null,
      "usage_known": false,
      "artifacts": [],
      "chain_depth": 0,
      "source_event_id": "21:labeled:2026-07-25T18:02:14Z",
      "enqueue_index": 0,
      "repo": "agentalec/care_fe",
      "deadline": "2026-07-25T18:33:21Z",
      "attempt_started_at": "2026-07-25T18:03:21Z"
    }
  ]
}
