{
  "ticket_id": "3",
  "pinned_comment_id": 5043543793,
  "status": "ACTIVE",
  "runs": [
    {
      "run_id": "34ec7b95644fcf2a",
      "task_id": "spec",
      "task_version": 1,
      "ticket_id": "3",
      "state": "RUNNING",
      "attempt": 0,
      "bindings": {
        "tracker": "github-issues",
        "agent-session": "copilot-cli",
        "messaging": "github-comment",
        "gate": "github-issue-comment"
      },
      "cost_usd": null,
      "tokens": null,
      "usage_known": false,
      "artifacts": [],
      "chain_depth": 0,
      "source_event_id": "3:opened:2026-07-22T08:19:47Z",
      "enqueue_index": 0,
      "repo": "agentalec/care_docs",
      "deadline": "2026-07-22T08:50:44Z",
      "attempt_started_at": "2026-07-22T08:20:44Z",
      "base_commit": "dbd221992b4569412c1969bffff99f2642160205"
    }
  ]
}
