{
  "ticket_id": "17",
  "pinned_comment_id": 5079716683,
  "status": "ACTIVE",
  "runs": [
    {
      "run_id": "e79ef6e1fc08b264",
      "task_id": "spec",
      "task_version": 1,
      "ticket_id": "17",
      "state": "QUEUED",
      "attempt": 0,
      "bindings": {},
      "cost_usd": null,
      "tokens": null,
      "usage_known": false,
      "artifacts": [],
      "chain_depth": 0,
      "source_event_id": "17:labeled:2026-07-25T18:01:27Z",
      "enqueue_index": 0,
      "repo": "agentalec/care_fe"
    }
  ]
}
