{
  "ticket_id": "19",
  "pinned_comment_id": 5079727186,
  "status": "ACTIVE",
  "runs": [
    {
      "run_id": "a9fe4d8438a1ce84",
      "task_id": "spec",
      "task_version": 1,
      "ticket_id": "19",
      "state": "SUCCEEDED",
      "attempt": 0,
      "bindings": {
        "tracker": "github-issues",
        "agent-session": "copilot-cli",
        "messaging": "github-comment",
        "gate": "github-issue-comment"
      },
      "cost_usd": 0.0,
      "tokens": null,
      "usage_known": true,
      "artifacts": [
        "specs/19/spec.md"
      ],
      "chain_depth": 0,
      "source_event_id": "19:labeled:2026-07-25T18:04:10Z",
      "enqueue_index": 0,
      "repo": "agentalec/care_fe",
      "deadline": "2026-07-25T21:02:57Z",
      "attempt_started_at": "2026-07-25T20:32:57Z",
      "base_commit": "5466816828ba496f9d4e6099e77360eb516ece31",
      "output_commit": "5466816828ba496f9d4e6099e77360eb516ece31",
      "pr_ref": null,
      "gate_requested_at": "2026-07-25T20:37:50Z",
      "gate_request_id": "5080482069",
      "pending_handoffs": []
    },
    {
      "run_id": "5639002120ba2aac",
      "task_id": "implement",
      "task_version": 1,
      "ticket_id": "19",
      "state": "FAILED",
      "attempt": 0,
      "bindings": {
        "tracker": "github-issues",
        "agent-session": "copilot-cli",
        "messaging": "github-comment"
      },
      "cost_usd": null,
      "tokens": null,
      "usage_known": false,
      "artifacts": [],
      "chain_depth": 1,
      "parent_run_id": "a9fe4d8438a1ce84",
      "handoff_key": "implement-dosage-highlighting",
      "repo": "agentalec/care_fe",
      "input_artifacts": [
        "specs/19/spec.md"
      ],
      "deadline": "2026-07-26T18:06:50Z",
      "attempt_started_at": "2026-07-26T16:36:50Z",
      "base_commit": "5466816828ba496f9d4e6099e77360eb516ece31"
    },
    {
      "run_id": "affdcc187749a5c0",
      "task_id": "implement",
      "task_version": 1,
      "ticket_id": "19",
      "state": "SUCCEEDED",
      "attempt": 1,
      "bindings": {
        "tracker": "github-issues",
        "agent-session": "copilot-cli",
        "messaging": "github-comment"
      },
      "cost_usd": 0.0,
      "tokens": null,
      "usage_known": true,
      "artifacts": [],
      "chain_depth": 1,
      "parent_run_id": "a9fe4d8438a1ce84",
      "handoff_key": "implement-dosage-highlighting",
      "repo": "agentalec/care_fe",
      "input_artifacts": [
        "specs/19/spec.md"
      ],
      "deadline": "2026-07-26T19:14:38Z",
      "attempt_started_at": "2026-07-26T17:44:38Z",
      "base_commit": "5466816828ba496f9d4e6099e77360eb516ece31",
      "output_commit": "5b15908502511a4cedef0e5082cd0ab9aac9247b",
      "pr_ref": "agentalec/care_fe#3"
    },
    {
      "run_id": "cfdb4e2389ee471b",
      "task_id": "review",
      "task_version": 1,
      "ticket_id": "19",
      "state": "SUCCEEDED",
      "attempt": 0,
      "bindings": {
        "tracker": "github-issues",
        "agent-session": "copilot-cli",
        "messaging": "github-comment"
      },
      "cost_usd": 0.0,
      "tokens": null,
      "usage_known": true,
      "artifacts": [
        "specs/19/review.md"
      ],
      "chain_depth": 2,
      "parent_run_id": "affdcc187749a5c0",
      "handoff_key": "review",
      "repo": "agentalec/care_fe",
      "input_artifacts": [
        "specs/19/spec.md"
      ],
      "deadline": "2026-07-26T18:27:07Z",
      "attempt_started_at": "2026-07-26T17:57:07Z",
      "base_commit": "5b15908502511a4cedef0e5082cd0ab9aac9247b",
      "output_commit": "5b15908502511a4cedef0e5082cd0ab9aac9247b",
      "pr_ref": "agentalec/care_fe#3"
    },
    {
      "run_id": "69a0f4b004d207eb",
      "task_id": "implement",
      "task_version": 1,
      "ticket_id": "19",
      "state": "SUCCEEDED",
      "attempt": 0,
      "bindings": {
        "tracker": "github-issues",
        "agent-session": "copilot-cli",
        "messaging": "github-comment"
      },
      "cost_usd": 0.0,
      "tokens": null,
      "usage_known": true,
      "artifacts": [],
      "chain_depth": 3,
      "parent_run_id": "cfdb4e2389ee471b",
      "handoff_key": "implement-ac2",
      "repo": "agentalec/care_fe",
      "input_artifacts": [
        "specs/19/spec.md",
        "specs/19/review.md"
      ],
      "deadline": "2026-07-26T19:31:53Z",
      "attempt_started_at": "2026-07-26T18:01:53Z",
      "base_commit": "5b15908502511a4cedef0e5082cd0ab9aac9247b",
      "output_commit": "1e7fc045e088c1ae38e319c31ae76422c478fd17",
      "pr_ref": "agentalec/care_fe#3"
    },
    {
      "run_id": "8c5e6a0c02ab56e2",
      "task_id": "review",
      "task_version": 1,
      "ticket_id": "19",
      "state": "SUCCEEDED",
      "attempt": 0,
      "bindings": {
        "tracker": "github-issues",
        "agent-session": "copilot-cli",
        "messaging": "github-comment"
      },
      "cost_usd": 0.0,
      "tokens": null,
      "usage_known": true,
      "artifacts": [
        "specs/19/review.md"
      ],
      "chain_depth": 4,
      "parent_run_id": "69a0f4b004d207eb",
      "handoff_key": "review",
      "repo": "agentalec/care_fe",
      "input_artifacts": [
        "specs/19/spec.md",
        "specs/19/review.md"
      ],
      "deadline": "2026-07-26T18:43:47Z",
      "attempt_started_at": "2026-07-26T18:13:47Z",
      "base_commit": "1e7fc045e088c1ae38e319c31ae76422c478fd17",
      "output_commit": "1e7fc045e088c1ae38e319c31ae76422c478fd17",
      "pr_ref": "agentalec/care_fe#3"
    },
    {
      "run_id": "96170afe4c1bbedc",
      "task_id": "qa",
      "task_version": 1,
      "ticket_id": "19",
      "state": "SUCCEEDED",
      "attempt": 0,
      "bindings": {
        "tracker": "github-issues",
        "agent-session": "copilot-cli",
        "messaging": "github-comment"
      },
      "cost_usd": 0.0,
      "tokens": null,
      "usage_known": true,
      "artifacts": [
        "specs/19/qa.md"
      ],
      "chain_depth": 5,
      "parent_run_id": "8c5e6a0c02ab56e2",
      "handoff_key": "qa-review-19",
      "repo": "agentalec/care_fe",
      "input_artifacts": [
        "specs/19/spec.md",
        "specs/19/review.md"
      ],
      "deadline": "2026-07-26T19:18:09Z",
      "attempt_started_at": "2026-07-26T18:18:09Z",
      "base_commit": "1e7fc045e088c1ae38e319c31ae76422c478fd17",
      "output_commit": "1e7fc045e088c1ae38e319c31ae76422c478fd17",
      "pr_ref": "agentalec/care_fe#3"
    },
    {
      "run_id": "2a31989f8f7bf984",
      "task_id": "finalize",
      "task_version": 1,
      "ticket_id": "19",
      "state": "RUNNING",
      "attempt": 0,
      "bindings": {
        "tracker": "github-issues",
        "agent-session": "copilot-cli",
        "messaging": "github-comment"
      },
      "cost_usd": null,
      "tokens": null,
      "usage_known": false,
      "artifacts": [],
      "chain_depth": 6,
      "parent_run_id": "96170afe4c1bbedc",
      "handoff_key": "finalize-19",
      "repo": "agentalec/care_fe",
      "input_artifacts": [
        "specs/19/spec.md",
        "specs/19/review.md",
        "specs/19/qa.md"
      ],
      "deadline": "2026-07-26T18:44:24Z",
      "attempt_started_at": "2026-07-26T18:29:24Z",
      "base_commit": "1e7fc045e088c1ae38e319c31ae76422c478fd17"
    }
  ],
  "work_repos": [
    {
      "repo": "agentalec/care_fe",
      "branch": "agent-hq/19",
      "base_branch": "develop",
      "recorded_head": "1e7fc045e088c1ae38e319c31ae76422c478fd17",
      "pr_ref": "agentalec/care_fe#3"
    }
  ]
}
